{
  "slug": "0009_python_penicillin_lstm",
  "name": "LSTM without lag features [Python version]",
  "description": "LSTM without lag features [Python version] - IndPenSim penicillin soft sensor.",
  "algorithm": "rnn",
  "status": "deployed",
  "version": "1.0.0",
  "uuid": null,
  "creation_date": "17-02-2025",
  "project_id": "P0001",
  "serving_status": "online",
  "ml_task": "regression",
  "model_category": "data_driven",
  "model_type": "black_box",
  "learner": "Long short-term memory (LSTM)",
  "author": "Suarez, C., Astudillo A., Metcalfe B., Koehorst J.J., Castillo E. & Corrales, D. C",
  "doi": null,
  "status_description": "Model is loaded and ready for predictions.",
  "sampling_interval": {
    "value": 12,
    "unit": "minutes",
    "aggregation": null
  },
  "validation": "Train-test split with early stopping",
  "n_instances": 89800,
  "prediction_horizon_min": null,
  "inputs": [
    {
      "name": "temperature",
      "type": "sensor",
      "unit": "K",
      "dtype": "float",
      "lag": 0,
      "feature_scaling": "Min-Max normalization",
      "expected_range": {
        "min": 298,
        "max": 308
      },
      "description": "Current temperature (T) in the bioreactor."
    },
    {
      "name": "pH",
      "type": "sensor",
      "unit": "pH",
      "dtype": "float",
      "lag": 0,
      "feature_scaling": "Min-Max normalization",
      "expected_range": {
        "min": 5.5,
        "max": 7.5
      },
      "description": "Current pH level in the bioreactor."
    },
    {
      "name": "dissolved_oxygen_concentration",
      "type": "sensor",
      "unit": "mg/L",
      "dtype": "float",
      "lag": 0,
      "feature_scaling": "Min-Max normalization",
      "expected_range": {
        "min": 0,
        "max": 10
      },
      "description": "Dissolved oxygen (DO) concentration."
    },
    {
      "name": "agitator",
      "type": "actuator",
      "unit": "rpm",
      "dtype": "float",
      "lag": 0,
      "feature_scaling": "Min-Max normalization",
      "expected_range": {
        "min": 100,
        "max": 1200
      },
      "description": "Agitation speed in revolutions per minute."
    },
    {
      "name": "CO2_percent_in_off_gas",
      "type": "sensor",
      "unit": "%",
      "dtype": "float",
      "lag": 0,
      "feature_scaling": "Min-Max normalization",
      "expected_range": {
        "min": 0,
        "max": 10
      },
      "description": "CO2 percentage in the off-gas (CO2,og)."
    },
    {
      "name": "oxygen_in_percent_in_off_gas",
      "type": "sensor",
      "unit": "%",
      "dtype": "float",
      "lag": 0,
      "feature_scaling": "Min-Max normalization",
      "expected_range": {
        "min": 10,
        "max": 21
      },
      "description": "O2 percentage in the off-gas (O2,og)."
    },
    {
      "name": "vessel_volume",
      "type": "computed_variable",
      "unit": "L",
      "dtype": "float",
      "lag": 0,
      "feature_scaling": "Min-Max normalization",
      "expected_range": {
        "min": 1,
        "max": 1000
      },
      "description": "Total volume of the bioreactor vessel (V)."
    },
    {
      "name": "sugar_feed_rate",
      "type": "actuator",
      "unit": "L/h",
      "dtype": "float",
      "lag": 0,
      "feature_scaling": "Min-Max normalization",
      "expected_range": {
        "min": 0,
        "max": 2
      },
      "description": "Sugar feed rate (Fs) into the bioreactor."
    }
  ],
  "outputs": [
    {
      "name": "penicillin_concentration",
      "type": "soft_sensor",
      "unit": "g/L",
      "dtype": "float",
      "role": "target",
      "forecast_horizon": 0,
      "feature_scaling": "Min-Max normalization",
      "expected_range": {
        "min": 0,
        "max": 50
      },
      "description": "Prediction of the penicillin concentration."
    }
  ],
  "config": {
    "cell_type": "LSTM",
    "input_window": 1,
    "layers": [
      {
        "type": "lstm",
        "units": 256,
        "activation": "relu",
        "return_sequences": true
      },
      {
        "type": "lstm",
        "units": 256,
        "activation": "relu",
        "return_sequences": false
      },
      {
        "type": "dropout",
        "rate": 0.2
      },
      {
        "type": "batchnorm"
      },
      {
        "type": "dense",
        "units": 256,
        "activation": "relu"
      },
      {
        "type": "dense",
        "units": 1,
        "activation": "relu"
      }
    ],
    "hidden_units": 256,
    "optimizer": "adam",
    "learning_rate": 0.001,
    "loss": "mse",
    "batch_size": 512,
    "epochs": 100,
    "dropout": 0.2
  },
  "metrics": {},
  "implementation": {
    "language": "python",
    "language_version": "3.12.7",
    "packages": [
      {
        "package": "tensorflow",
        "version": "2.18.0",
        "classes": [
          "keras.layers.LSTM",
          "keras.layers.Dropout",
          "keras.layers.BatchNormalization",
          "keras.layers.Dense",
          "keras.models.Sequential",
          "keras.callbacks.EarlyStopping",
          "keras.optimizers.Adam"
        ]
      },
      {
        "package": "sklearn",
        "version": "1.5.2",
        "classes": [
          "preprocessing.MinMaxScaler"
        ]
      }
    ],
    "scaler_inputs": "0009_[Python]_penicillin_LSTM_features_scaler.pkl",
    "scaler_outputs": "0009_[Python]_penicillin_LSTM_target_scaler.pkl"
  },
  "artifact": {
    "path": "/models/IndPenSim/0009_[Python]_penicillin_LSTM.keras",
    "format": "keras",
    "size_bytes": null,
    "sha256": "sha256:<fill-on-register>",
    "additional_files": []
  },
  "training": {
    "framework": "python",
    "framework_version": "3.12.7",
    "dataset_hash": "sha256:<indpensim-train-hash>",
    "training_experiment_ids": [
      "1",
      "3",
      "4",
      "5",
      "6",
      "7",
      "8",
      "9",
      "10",
      "11",
      "12",
      "13",
      "17",
      "19",
      "20",
      "21",
      "22",
      "24",
      "25",
      "26",
      "27",
      "29",
      "30",
      "31",
      "33",
      "34",
      "36",
      "37",
      "38",
      "39",
      "40",
      "42",
      "43",
      "44",
      "45",
      "47",
      "48",
      "49",
      "50",
      "51",
      "53",
      "54",
      "55",
      "56",
      "57",
      "58",
      "59",
      "61",
      "62",
      "65",
      "66",
      "67",
      "69",
      "70",
      "71",
      "72",
      "73",
      "74",
      "75",
      "76",
      "77",
      "80",
      "81",
      "82",
      "83",
      "84",
      "85",
      "87",
      "88",
      "89",
      "90",
      "92",
      "93",
      "94",
      "95",
      "96",
      "97",
      "98",
      "99"
    ],
    "started_at": null,
    "completed_at": null,
    "trained_by": "Suarez, C., Astudillo A., Metcalfe B., Koehorst J.J., Castillo E. & Corrales, D. C",
    "random_seed": null
  },
  "lineage": {
    "parent_model": null,
    "superseded_by": null,
    "fine_tuned_from": null,
    "federation": null
  },
  "governance": {
    "validation_status": "approved",
    "validated_by": null,
    "validated_at": null,
    "validation_notes": "Train-test split with early stopping",
    "intended_use": "Online soft-sensing of penicillin concentration on IndPenSim fed-batch runs.",
    "risks_bias_limitations": "Trained on the IndPenSim benchmark (simulated industrial penicillin fermentation); validate before transfer to other organisms/scales.",
    "reference_publication": null,
    "tags": [
      "IndPenSim",
      "penicillin",
      "soft_sensor"
    ]
  }
}