{
  "slug": "indpensim_fault_logreg_tmpl",
  "name": "Batch fault classifier template",
  "description": "ILLUSTRATIVE template for Batch fault classifier template on IndPenSim inputs; not a trained model.",
  "algorithm": "logistic_regression",
  "status": "draft",
  "version": "1.0.0",
  "uuid": null,
  "creation_date": null,
  "project_id": "P0001",
  "serving_status": "offline",
  "ml_task": "classification",
  "model_category": "data_driven",
  "model_type": "black_box",
  "learner": "Logistic regression",
  "author": "(template)",
  "doi": null,
  "status_description": "Illustrative template - no IndPenSim model of this family exists yet.",
  "sampling_interval": {
    "value": 12,
    "unit": "minutes",
    "aggregation": null
  },
  "validation": "(not trained)",
  "n_instances": null,
  "prediction_horizon_min": null,
  "inputs": [
    {
      "name": "temperature",
      "type": "sensor",
      "unit": "K",
      "dtype": "float",
      "lag": 0,
      "feature_scaling": "none",
      "expected_range": {
        "min": 298,
        "max": 308
      },
      "description": "Current temperature (T) in the bioreactor."
    },
    {
      "name": "pH",
      "type": "sensor",
      "unit": "pH",
      "dtype": "float",
      "lag": 0,
      "feature_scaling": "none",
      "expected_range": {
        "min": 5.5,
        "max": 7.5
      },
      "description": "Current pH level in the bioreactor."
    },
    {
      "name": "dissolved_oxygen_concentration",
      "type": "sensor",
      "unit": "mg/L",
      "dtype": "float",
      "lag": 0,
      "feature_scaling": "none",
      "expected_range": {
        "min": 0,
        "max": 10
      },
      "description": "Dissolved oxygen (DO) concentration."
    },
    {
      "name": "agitator",
      "type": "actuator",
      "unit": "rpm",
      "dtype": "float",
      "lag": 0,
      "feature_scaling": "none",
      "expected_range": {
        "min": 100,
        "max": 1200
      },
      "description": "Agitation speed in revolutions per minute."
    },
    {
      "name": "CO2_percent_in_off_gas",
      "type": "sensor",
      "unit": "%",
      "dtype": "float",
      "lag": 0,
      "feature_scaling": "none",
      "expected_range": {
        "min": 0,
        "max": 10
      },
      "description": "CO2 percentage in the off-gas (CO2,og)."
    },
    {
      "name": "oxygen_in_percent_in_off_gas",
      "type": "sensor",
      "unit": "%",
      "dtype": "float",
      "lag": 0,
      "feature_scaling": "none",
      "expected_range": {
        "min": 10,
        "max": 21
      },
      "description": "O2 percentage in the off-gas (O2,og)."
    },
    {
      "name": "vessel_volume",
      "type": "computed_variable",
      "unit": "L",
      "dtype": "float",
      "lag": 0,
      "feature_scaling": "none",
      "expected_range": {
        "min": 1,
        "max": 1000
      },
      "description": "Total volume of the bioreactor vessel (V)."
    },
    {
      "name": "sugar_feed_rate",
      "type": "actuator",
      "unit": "L/h",
      "dtype": "float",
      "lag": 0,
      "feature_scaling": "none",
      "expected_range": {
        "min": 0,
        "max": 2
      },
      "description": "Sugar feed rate (Fs) into the bioreactor."
    }
  ],
  "outputs": [
    {
      "name": "is_faulty_batch",
      "type": "experiment",
      "dtype": "bool",
      "role": "target",
      "description": "Whether the batch is one of the 10 IndPenSim fault batches."
    }
  ],
  "config": {
    "penalty": "l2",
    "C": 1.0,
    "solver": "lbfgs",
    "multi_class": "auto",
    "max_iter": 200
  },
  "metrics": {},
  "implementation": {},
  "artifact": {
    "path": "/models/IndPenSim/indpensim_fault_logreg_tmpl.pkl",
    "format": "joblib",
    "size_bytes": null,
    "sha256": "sha256:<fill-on-register>",
    "additional_files": []
  },
  "training": {
    "framework": "python",
    "framework_version": "",
    "dataset_hash": "sha256:<indpensim-train-hash>",
    "training_experiment_ids": [
      "1",
      "3",
      "4",
      "5",
      "6",
      "7",
      "8",
      "9",
      "10",
      "11",
      "12",
      "13",
      "17",
      "19",
      "20",
      "21",
      "22",
      "24",
      "25",
      "26",
      "27",
      "29",
      "30",
      "31",
      "33",
      "34",
      "36",
      "37",
      "38",
      "39",
      "40",
      "42",
      "43",
      "44",
      "45",
      "47",
      "48",
      "49",
      "50",
      "51",
      "53",
      "54",
      "55",
      "56",
      "57",
      "58",
      "59",
      "61",
      "62",
      "65",
      "66",
      "67",
      "69",
      "70",
      "71",
      "72",
      "73",
      "74",
      "75",
      "76",
      "77",
      "80",
      "81",
      "82",
      "83",
      "84",
      "85",
      "87",
      "88",
      "89",
      "90",
      "92",
      "93",
      "94",
      "95",
      "96",
      "97",
      "98",
      "99"
    ],
    "started_at": null,
    "completed_at": null,
    "trained_by": "(template)",
    "random_seed": null
  },
  "lineage": {
    "parent_model": null,
    "superseded_by": null,
    "fine_tuned_from": null,
    "federation": null
  },
  "governance": {
    "validation_status": "pending",
    "validated_by": null,
    "validated_at": null,
    "validation_notes": "(not trained)",
    "intended_use": "Online soft-sensing of penicillin concentration on IndPenSim fed-batch runs.",
    "risks_bias_limitations": "Trained on the IndPenSim benchmark (simulated industrial penicillin fermentation); validate before transfer to other organisms/scales.",
    "reference_publication": null,
    "tags": [
      "IndPenSim",
      "penicillin",
      "soft_sensor"
    ]
  }
}